<?xml version="1.0" encoding="utf-8" ?>
<?xml-stylesheet type="text/xsl" href="xslt/page.xslt" ?>
<page xmlns:xsd="http://www.w3.org/2001/XMLSchema-instance" xsd:noNamespaceSchemaLocation="./xsd/page.xsd">
    <pageInfo nr="1" lastPage="true" chapter="Steckbrief" typ="overview" />
    <table>
        <row>
            <column>
                Amtssprache
            </column>
            <column>
                Englisch
            </column>
        </row>
        <row>
            <column>
                Hauptstadt
            </column>
            <column>
                Nassau
            </column>
        </row>
        <row>
            <column>
                Staatsform
            </column>
            <column>
                Parlamentarische Monarchie
            </column>
        </row>
        <row>
            <column>
                Staatsoberhaupt
            </column>
            <column>
                Königin Elisabeth II.
            </column>
        </row>
        <row>
            <column>
                Regierungschef
            </column>
            <column>
                Premierminister Hubert Ingraham
            </column>
        </row>
        <row>
            <column>
                Fläche
            </column>
            <column>
                13.940 km²
            </column>
        </row>
        <row>
            <column>
                Einwohnerzahl
            </column>
            <column>
                309.156 (Quelle: CIA 2009)
            </column>
        </row>
        <row>
            <column>
                Bruttoinlandsprodukt
            </column>
            <column>
                19.781 US$ (34.)
            </column>
        </row>
        <row>
            <column>
                Nationalhymne
            </column>
            <column>
                March On, Bahamaland
            </column>
        </row>
    </table>
</page>
    
