<?xml version="1.0" encoding="utf-8" ?>
<?xml-stylesheet type="text/xsl" href="xslt/page.xslt" ?>
<page xmlns:xsd="http://www.w3.org/2001/XMLSchema-instance" xsd:noNamespaceSchemaLocation="./xsd/page.xsd">
    <pageInfo nr="1" lastPage="true" chapter="Impressum" typ="normal" />
    <left>
      <paragraph headline="LLorem FH">

          gemäß § 5 TMG:<br></br>
          <br></br>
      Ipsumstraße 111<br></br>
      Hotel Alte Banane 77<br></br>
      90210 Gotham City<br></br>
          <br></br>
      Vertreten durch:
          <br></br>
      Herrn Kai Hufenbach<br></br>
      Herrn Oliver Plehn<br></br><br></br>
      </paragraph>
      <paragraph headline="Kontakt:">
          <br></br>
        Telefon:<br></br>
          +49 (0) 123 44 55 66<br></br>
          <br></br>
          Telefax:<br></br>
          +49 (0) 123 44 55 99<br></br>
          <br></br>
        E-Mail:<br></br>

        bahamas@pyjamas.de
      </paragraph>
    </left>
    <right>
      <paragraph headline="Umsatzsteuer-ID:">

      Umsatzsteuer-Identifikationsnummer gemäß §27 a Umsatzsteuergesetz:<br></br>
      DE 999 999 999<br></br><br></br>
     
          Wirtschafts-Identifikationsnummer gemäß §139 c Abgabenordnung:<br></br>
      DE 999 999 999<br></br><br></br>
  </paragraph>
      <paragraph headline="Aufsichtsbehörde:">

      Landratsamt Oberquakenbrückszieglstadl<br></br><br></br>
      Quelle: Durch den vom Rechtsanwalt Sören Siebert bereitgestellten Impressum-Generator generiert.<br></br>
      </paragraph>
   

      </right>
</page>
    
